{
  "$schema": "https://json-schema.org/draft/2020-12/schema",
  "$id": "https://mpx.dev/schemas/mpxconfig.schema.json",
  "type": "object",
  "additionalProperties": false,
  "required": ["schemaVersion", "project", "repository"],
  "properties": {
    "$schema": {
      "type": "string"
    },
    "schemaVersion": {
      "const": 1
    },
    "project": {
      "type": "object",
      "additionalProperties": false,
      "required": ["id"],
      "properties": {
        "id": {
          "type": "string",
          "pattern": "^[A-Za-z0-9](?:[A-Za-z0-9._-]{0,62}[A-Za-z0-9])?/[A-Za-z0-9](?:[A-Za-z0-9._-]{0,62}[A-Za-z0-9])?$",
          "maxLength": 129
        }
      }
    },
    "repository": {
      "type": "object",
      "additionalProperties": false,
      "required": ["provider", "remote"],
      "properties": {
        "provider": {
          "type": "string",
          "pattern": "^[a-z][a-z0-9-]{0,62}$"
        },
        "remote": {
          "type": "string",
          "minLength": 1
        }
      }
    },
    "issues": {
      "oneOf": [
        {
          "type": "object",
          "additionalProperties": false,
          "required": ["provider"],
          "properties": {
            "provider": {
              "allOf": [
                {
                  "type": "string",
                  "pattern": "^[a-z][a-z0-9-]{0,62}$"
                },
                {
                  "not": {
                    "enum": ["kanbanflow", "local"]
                  }
                }
              ]
            }
          }
        },
        {
          "type": "object",
          "additionalProperties": false,
          "required": ["provider", "store"],
          "properties": {
            "provider": { "const": "local" },
            "store": { "$ref": "#/$defs/logicalId" },
            "view": { "$ref": "#/$defs/logicalId" }
          }
        },
        {
          "type": "object",
          "additionalProperties": false,
          "required": ["provider", "boardId", "states"],
          "properties": {
            "provider": {
              "const": "kanbanflow"
            },
            "boardId": {
              "type": "string",
              "minLength": 1
            },
            "boardName": {
              "type": "string"
            },
            "states": {
              "type": "object",
              "additionalProperties": false,
              "required": ["todo", "wip", "review", "done"],
              "properties": {
                "todo": {
                  "type": "string"
                },
                "wip": {
                  "type": "string"
                },
                "review": {
                  "type": "string"
                },
                "done": {
                  "type": "string"
                },
                "archive": {
                  "type": "string"
                }
              }
            }
          }
        }
      ]
    },
    "tooling": {
      "type": "object",
      "additionalProperties": false,
      "properties": {
        "packageManager": {
          "enum": ["auto", "pnpm", "yarn", "npm", "bun", "none"]
        }
      }
    },
    "workflow": {
      "type": "object",
      "additionalProperties": false,
      "properties": {
        "branch": {
          "type": "object",
          "additionalProperties": false,
          "properties": {
            "base": {
              "type": "string"
            },
            "template": {
              "type": "string",
              "pattern": "^(?:[^{}]|[{](?:author|issue|slug)[}])+$"
            }
          }
        },
        "codeReview": {
          "type": "object",
          "additionalProperties": false,
          "properties": {
            "openAsDraft": {
              "type": "boolean"
            },
            "markReady": {
              "enum": ["human", "agent"]
            },
            "merge": {
              "enum": ["human", "agent"]
            }
          }
        }
      }
    },
    "worktrees": {
      "type": "object",
      "additionalProperties": false,
      "properties": {
        "postCreate": {
          "type": "object",
          "additionalProperties": false,
          "required": ["execution"],
          "properties": {
            "execution": {
              "enum": ["foreground", "background", "none"]
            },
            "steps": {
              "type": "array",
              "maxItems": 64,
              "items": {
                "oneOf": [
                  {
                    "$ref": "#/$defs/installStep"
                  },
                  {
                    "$ref": "#/$defs/scriptStep"
                  },
                  {
                    "$ref": "#/$defs/executableStep"
                  }
                ]
              }
            }
          },
          "allOf": [
            {
              "if": {
                "properties": {
                  "execution": {
                    "const": "none"
                  }
                },
                "required": ["execution"]
              },
              "then": {
                "properties": {
                  "steps": {
                    "maxItems": 0,
                    "type": "array"
                  }
                }
              }
            }
          ]
        }
      }
    },
    "development": {
      "type": "object",
      "additionalProperties": false,
      "required": ["services"],
      "properties": {
        "services": {
          "type": "object",
          "additionalProperties": {
            "$ref": "#/$defs/service"
          }
        }
      }
    }
  },
  "$defs": {
    "logicalId": { "type": "string", "pattern": "^[a-z0-9]+(?:[._-][a-z0-9]+)*$", "maxLength": 64 },
    "installStep": {
      "type": "object",
      "additionalProperties": false,
      "required": ["id", "uses"],
      "properties": {
        "id": {
          "type": "string",
          "pattern": "^[A-Za-z0-9][A-Za-z0-9._-]{0,63}$"
        },
        "dependsOn": {
          "type": "array",
          "maxItems": 64,
          "items": {
            "type": "string",
            "pattern": "^[A-Za-z0-9][A-Za-z0-9._-]{0,63}$"
          },
          "uniqueItems": true
        },
        "required": {
          "type": "boolean"
        },
        "timeoutSeconds": {
          "type": "integer",
          "minimum": 1,
          "maximum": 3600
        },
        "cwd": {
          "type": "string",
          "minLength": 1,
          "maxLength": 256,
          "pattern": "^(?![A-Za-z]:)(?!/)(?!.*(?:^|/)\\.\\.(?:/|$))[^\u0000-\u001f]+$",
          "allOf": [
            {
              "not": {
                "pattern": "\\\\"
              }
            }
          ]
        },
        "environment": {
          "type": "array",
          "maxItems": 32,
          "items": {
            "type": "string",
            "pattern": "^[A-Z_][A-Z0-9_]{0,63}$"
          },
          "uniqueItems": true
        },
        "uses": {
          "const": "package-install"
        }
      }
    },
    "scriptStep": {
      "type": "object",
      "additionalProperties": false,
      "required": ["id", "uses", "script"],
      "properties": {
        "id": {
          "type": "string",
          "pattern": "^[A-Za-z0-9][A-Za-z0-9._-]{0,63}$"
        },
        "dependsOn": {
          "type": "array",
          "maxItems": 64,
          "items": {
            "type": "string",
            "pattern": "^[A-Za-z0-9][A-Za-z0-9._-]{0,63}$"
          },
          "uniqueItems": true
        },
        "required": {
          "type": "boolean"
        },
        "timeoutSeconds": {
          "type": "integer",
          "minimum": 1,
          "maximum": 3600
        },
        "cwd": {
          "type": "string",
          "minLength": 1,
          "maxLength": 256,
          "pattern": "^(?![A-Za-z]:)(?!/)(?!.*(?:^|/)\\.\\.(?:/|$))[^\u0000-\u001f]+$",
          "allOf": [
            {
              "not": {
                "pattern": "\\\\"
              }
            }
          ]
        },
        "environment": {
          "type": "array",
          "maxItems": 32,
          "items": {
            "type": "string",
            "pattern": "^[A-Z_][A-Z0-9_]{0,63}$"
          },
          "uniqueItems": true
        },
        "uses": {
          "const": "package-script"
        },
        "script": {
          "type": "string",
          "minLength": 1,
          "maxLength": 128,
          "pattern": "^[^\\u0000-\\u001F]+$"
        }
      }
    },
    "service": {
      "type": "object",
      "additionalProperties": false,
      "required": ["scope", "port", "start"],
      "properties": {
        "scope": {
          "enum": ["checkout", "project"]
        },
        "port": {
          "type": "object",
          "additionalProperties": false,
          "required": ["mode"],
          "properties": {
            "mode": {
              "enum": ["managed", "fixed-shared"]
            },
            "preferred": {
              "type": "integer",
              "minimum": 1,
              "maximum": 65535
            },
            "family": {
              "type": "string",
              "pattern": "^[A-Za-z0-9][A-Za-z0-9._-]{0,63}$"
            }
          },
          "allOf": [
            {
              "if": {
                "properties": {
                  "mode": {
                    "const": "fixed-shared"
                  }
                },
                "required": ["mode"]
              },
              "then": {
                "properties": {
                  "preferred": {}
                },
                "required": ["preferred"]
              }
            }
          ]
        },
        "environmentVariable": {
          "type": "string",
          "pattern": "^[A-Z_][A-Z0-9_]*$"
        },
        "protocol": {
          "enum": ["http", "https", "tcp"]
        },
        "start": {
          "oneOf": [
            {
              "type": "object",
              "additionalProperties": false,
              "required": ["type", "script"],
              "properties": {
                "type": { "const": "package-script" },
                "script": { "type": "string", "minLength": 1 }
              }
            },
            {
              "type": "object",
              "additionalProperties": false,
              "required": ["type", "kind"],
              "properties": {
                "type": { "const": "external" },
                "kind": { "const": "database" }
              }
            },
            {
              "type": "object",
              "additionalProperties": false,
              "required": ["type"],
              "properties": {
                "type": { "const": "test-only" }
              }
            }
          ]
        }
      }
    },
    "executableStep": {
      "type": "object",
      "additionalProperties": false,
      "required": ["id", "uses", "argv"],
      "properties": {
        "id": {
          "type": "string",
          "pattern": "^[A-Za-z0-9][A-Za-z0-9._-]{0,63}$"
        },
        "dependsOn": {
          "type": "array",
          "maxItems": 64,
          "items": {
            "type": "string",
            "pattern": "^[A-Za-z0-9][A-Za-z0-9._-]{0,63}$"
          },
          "uniqueItems": true
        },
        "required": {
          "type": "boolean"
        },
        "timeoutSeconds": {
          "type": "integer",
          "minimum": 1,
          "maximum": 3600
        },
        "cwd": {
          "type": "string",
          "minLength": 1,
          "maxLength": 256,
          "pattern": "^(?![A-Za-z]:)(?!/)(?!.*(?:^|/)\\.\\.(?:/|$))[^\u0000-\u001f]+$",
          "allOf": [
            {
              "not": {
                "pattern": "\\\\"
              }
            }
          ]
        },
        "environment": {
          "type": "array",
          "maxItems": 32,
          "items": {
            "type": "string",
            "pattern": "^[A-Z_][A-Z0-9_]{0,63}$"
          },
          "uniqueItems": true
        },
        "uses": {
          "const": "executable"
        },
        "argv": {
          "type": "array",
          "minItems": 1,
          "maxItems": 64,
          "items": {
            "type": "string",
            "minLength": 1,
            "maxLength": 4096,
            "pattern": "^[^\\u0000-\\u001F]+$"
          }
        }
      }
    }
  }
}
