{
  "$schema": "https://mpx.dev/schemas/mpxconfig.schema.json",
  "schemaVersion": 1,
  "project": {
    "id": "MartinoPolo/mpx"
  },
  "repository": {
    "provider": "github",
    "remote": "origin"
  },
  "issues": {
    "provider": "github"
  },
  "tooling": {
    "packageManager": "pnpm"
  }
}
