{
  "schemaVersion": 1,
  "project": { "id": "service-manifests/tests" },
  "repository": { "provider": "generic", "remote": "origin" },
  "development": {
    "services": {
      "test-server": {
        "scope": "checkout",
        "port": { "mode": "managed", "preferred": 4173 },
        "environmentVariable": "TEST_SERVER_URL",
        "protocol": "http",
        "start": { "type": "test-only" }
      }
    }
  }
}
