{"schemaVersion":1,"project":{"id":"phase-h/checkout"},"repository":{"provider":"generic","remote":"origin"},"development":{"services":{"web":{"scope":"checkout","port":{"mode":"managed","preferred":5173},"environmentVariable":"WEB_URL","protocol":"http","start":{"type":"package-script","script":"dev"}}}}}
